    1   0.000000 192.168.0.17 → 230.0.0.1    UDP 92 56610 → 6666 Len=50
    2   0.797924 192.168.0.17 → 13.107.21.200 TCP 66 52742 → 443 [SYN] Seq=0 Win=65535 Len=0 MSS=1460 WS=256 SACK_PERM=1
    3   0.825744 13.107.21.200 → 192.168.0.17 TCP 66 443 → 52742 [SYN, ACK] Seq=0 Ack=1 Win=65535 Len=0 MSS=1440 WS=256 SACK_PERM=1
    4   0.825844 192.168.0.17 → 13.107.21.200 TCP 54 52742 → 443 [ACK] Seq=1 Ack=1 Win=262144 Len=0
    5   0.826216 192.168.0.17 → 13.107.21.200 TLSv1.2 547 Client Hello
    6   0.852558 13.107.21.200 → 192.168.0.17 TCP 60 443 → 52742 [ACK] Seq=1 Ack=494 Win=262144 Len=0
    7   0.852558 13.107.21.200 → 192.168.0.17 TLSv1.2 204 Server Hello, Change Cipher Spec, Encrypted Handshake Message
    8   0.852620 192.168.0.17 → 13.107.21.200 TCP 54 52742 → 443 [ACK] Seq=494 Ack=151 Win=261888 Len=0
    9   0.853179 192.168.0.17 → 13.107.21.200 TLSv1.2 105 Change Cipher Spec, Encrypted Handshake Message
   10   0.854322 192.168.0.17 → 13.107.21.200 TLSv1.2 141 Application Data
   11   0.854468 192.168.0.17 → 13.107.21.200 TLSv1.2 747 Application Data
   12   0.882103 13.107.21.200 → 192.168.0.17 TCP 60 443 → 52742 [ACK] Seq=151 Ack=632 Win=262144 Len=0
   13   0.882103 13.107.21.200 → 192.168.0.17 TLSv1.2 123 Application Data
   14   0.882164 192.168.0.17 → 13.107.21.200 TCP 54 52742 → 443 [ACK] Seq=1325 Ack=220 Win=261888 Len=0
   15   0.882261 192.168.0.17 → 13.107.21.200 TLSv1.2 92 Application Data
   16   0.886474 13.107.21.200 → 192.168.0.17 TLSv1.2 92 Application Data
   17   0.886543 192.168.0.17 → 13.107.21.200 TCP 54 52742 → 443 [ACK] Seq=1363 Ack=258 Win=261632 Len=0
   18   0.888723 192.168.0.17 → 104.16.60.37 TLSv1.2 104 Application Data
   19   0.908812 104.16.60.37 → 192.168.0.17 TCP 60 443 → 52684 [ACK] Seq=1 Ack=51 Win=34 Len=0
   20   0.911718 13.107.21.200 → 192.168.0.17 TCP 60 443 → 52742 [ACK] Seq=258 Ack=1363 Win=261376 Len=0
   21   0.924392 13.107.21.200 → 192.168.0.17 TLSv1.2 298 Application Data
   22   0.924467 192.168.0.17 → 13.107.21.200 TCP 54 52742 → 443 [ACK] Seq=1363 Ack=502 Win=261632 Len=0
   23   1.000231 192.168.0.17 → 230.0.0.1    UDP 92 56610 → 6666 Len=50
   24   1.093777 104.16.60.37 → 192.168.0.17 TLSv1.2 85 Application Data
   25   1.134981 192.168.0.17 → 104.16.60.37 TCP 54 52684 → 443 [ACK] Seq=51 Ack=32 Win=254 Len=0
   26   1.142378 192.168.0.17 → 13.107.21.200 TCP 1494 [TCP segment of a reassembled PDU]
   27   1.142387 192.168.0.17 → 13.107.21.200 TLSv1.2 870 Application Data
   28   1.168649 13.107.21.200 → 192.168.0.17 TCP 60 443 → 52742 [ACK] Seq=502 Ack=2803 Win=262656 Len=0
   29   1.168650 13.107.21.200 → 192.168.0.17 TCP 60 443 → 52742 [ACK] Seq=502 Ack=3619 Win=261888 Len=0
   30   1.257197 13.107.21.200 → 192.168.0.17 TCP 1514 [TCP segment of a reassembled PDU]
   31   1.257198 13.107.21.200 → 192.168.0.17 TLSv1.2 811 Application Data
   32   1.257269 192.168.0.17 → 13.107.21.200 TCP 54 52742 → 443 [ACK] Seq=3619 Ack=2719 Win=262144 Len=0
   33   1.257368 13.107.21.200 → 192.168.0.17 TLSv1.2 92 Application Data
   34   1.257387 192.168.0.17 → 13.107.21.200 TCP 54 52742 → 443 [ACK] Seq=3619 Ack=2757 Win=261888 Len=0
   35   1.268850 192.168.0.17 → 89.2.0.1     DNS 88 Standard query 0x0f4c A store-images.s-microsoft.com
   36   1.277017     89.2.0.1 → 192.168.0.17 DNS 295 Standard query response 0x0f4c A store-images.s-microsoft.com CNAME s-microsoft.com.storeimages.akadns.net CNAME store-images.s-microsoft.com.nsatc.net CNAME store-images.s-microsoft.com-c.edgekey.net CNAME e12564.dspb.akamaiedge.net A 23.57.6.200
   37   1.277578 192.168.0.17 → 23.57.6.200  TCP 66 52743 → 443 [SYN] Seq=0 Win=65535 Len=0 MSS=1460 WS=256 SACK_PERM=1
   38   1.277608 192.168.0.17 → 23.57.6.200  TCP 66 52744 → 443 [SYN] Seq=0 Win=65535 Len=0 MSS=1460 WS=256 SACK_PERM=1
   39   1.305697  23.57.6.200 → 192.168.0.17 TCP 66 443 → 52743 [SYN, ACK] Seq=0 Ack=1 Win=29200 Len=0 MSS=1460 SACK_PERM=1 WS=128
   40   1.305697  23.57.6.200 → 192.168.0.17 TCP 66 443 → 52744 [SYN, ACK] Seq=0 Ack=1 Win=29200 Len=0 MSS=1460 SACK_PERM=1 WS=128
   41   1.305765 192.168.0.17 → 23.57.6.200  TCP 54 52743 → 443 [ACK] Seq=1 Ack=1 Win=262144 Len=0
   42   1.305829 192.168.0.17 → 23.57.6.200  TCP 54 52744 → 443 [ACK] Seq=1 Ack=1 Win=262144 Len=0
   43   1.306232 192.168.0.17 → 23.57.6.200  TLSv1.2 271 Client Hello
   44   1.306341 192.168.0.17 → 23.57.6.200  TLSv1.2 271 Client Hello
   45   1.329442  23.57.6.200 → 192.168.0.17 TCP 60 443 → 52744 [ACK] Seq=1 Ack=218 Win=30336 Len=0
   46   1.329443  23.57.6.200 → 192.168.0.17 TCP 60 443 → 52743 [ACK] Seq=1 Ack=218 Win=30336 Len=0
   47   1.329909  23.57.6.200 → 192.168.0.17 TLSv1.2 1514 Server Hello
   48   1.329910  23.57.6.200 → 192.168.0.17 TCP 1514 443 → 52744 [ACK] Seq=1461 Ack=218 Win=30336 Len=1460 [TCP segment of a reassembled PDU]
   49   1.329937 192.168.0.17 → 23.57.6.200  TCP 54 52744 → 443 [ACK] Seq=218 Ack=2921 Win=262144 Len=0
   50   1.330594  23.57.6.200 → 192.168.0.17 TLSv1.2 1230 Certificate [TCP segment of a reassembled PDU]
   51   1.330595  23.57.6.200 → 192.168.0.17 TLSv1.2 1514 Server Hello
   52   1.330595  23.57.6.200 → 192.168.0.17 TCP 1514 443 → 52743 [ACK] Seq=1461 Ack=218 Win=30336 Len=1460 [TCP segment of a reassembled PDU]
   53   1.330596  23.57.6.200 → 192.168.0.17 TLSv1.2 1230 Certificate [TCP segment of a reassembled PDU]
   54   1.330617 192.168.0.17 → 23.57.6.200  TCP 54 52744 → 443 [ACK] Seq=218 Ack=4097 Win=260864 Len=0
   55   1.330674 192.168.0.17 → 23.57.6.200  TCP 54 52743 → 443 [ACK] Seq=218 Ack=4097 Win=262144 Len=0
   56   1.331524  23.57.6.200 → 192.168.0.17 TLSv1.2 1514 Certificate Status [TCP segment of a reassembled PDU]
   57   1.331525  23.57.6.200 → 192.168.0.17 TLSv1.2 1514 Certificate Status [TCP segment of a reassembled PDU]
   58   1.331545 192.168.0.17 → 23.57.6.200  TCP 54 52743 → 443 [ACK] Seq=218 Ack=5557 Win=262144 Len=0
   59   1.331599 192.168.0.17 → 23.57.6.200  TCP 54 52744 → 443 [ACK] Seq=218 Ack=5557 Win=262144 Len=0
   60   1.346883  23.57.6.200 → 192.168.0.17 TLSv1.2 162 Server Key Exchange, Server Hello Done
   61   1.346918 192.168.0.17 → 23.57.6.200  TCP 54 52744 → 443 [ACK] Seq=218 Ack=5665 Win=261888 Len=0
   62   1.349534  23.57.6.200 → 192.168.0.17 TLSv1.2 162 Server Key Exchange, Server Hello Done
   63   1.349570 192.168.0.17 → 23.57.6.200  TCP 54 52743 → 443 [ACK] Seq=218 Ack=5665 Win=261888 Len=0
   64   1.350964 192.168.0.17 → 23.57.6.200  TLSv1.2 180 Client Key Exchange, Change Cipher Spec, Encrypted Handshake Message
   65   1.351124 192.168.0.17 → 23.57.6.200  TLSv1.2 676 Application Data
   66   1.351453 192.168.0.17 → 23.57.6.200  TLSv1.2 180 Client Key Exchange, Change Cipher Spec, Encrypted Handshake Message
   67   1.351588 192.168.0.17 → 23.57.6.200  TLSv1.2 676 Application Data
   68   1.374508  23.57.6.200 → 192.168.0.17 TCP 60 443 → 52744 [ACK] Seq=5665 Ack=966 Win=31616 Len=0
   69   1.374509  23.57.6.200 → 192.168.0.17 TCP 60 443 → 52743 [ACK] Seq=5665 Ack=966 Win=31616 Len=0
   70   1.375036  23.57.6.200 → 192.168.0.17 TLSv1.2 312 New Session Ticket, Change Cipher Spec, Encrypted Handshake Message
   71   1.375037  23.57.6.200 → 192.168.0.17 TLSv1.2 312 New Session Ticket, Change Cipher Spec, Encrypted Handshake Message
   72   1.375037  23.57.6.200 → 192.168.0.17 TCP 1514 [TCP segment of a reassembled PDU]
   73   1.375039  23.57.6.200 → 192.168.0.17 TLSv1.2 160 Application Data
   74   1.375040  23.57.6.200 → 192.168.0.17 TLSv1.2 1230 Application Data
   75   1.375092 192.168.0.17 → 23.57.6.200  TCP 54 52744 → 443 [ACK] Seq=966 Ack=7099 Win=262144 Len=0
   76   1.375160 192.168.0.17 → 23.57.6.200  TCP 54 52743 → 443 [ACK] Seq=966 Ack=7489 Win=262144 Len=0
   77   1.617704 192.168.0.17 → 13.107.21.200 TLSv1.2 435 Application Data
   78   1.617868 192.168.0.17 → 13.107.21.200 TCP 1494 [TCP segment of a reassembled PDU]
   79   1.617885 192.168.0.17 → 13.107.21.200 TCP 1494 52742 → 443 [ACK] Seq=5440 Ack=2757 Win=261888 Len=1440 [TCP segment of a reassembled PDU]
   80   1.617889 192.168.0.17 → 13.107.21.200 TCP 1494 52742 → 443 [ACK] Seq=6880 Ack=2757 Win=261888 Len=1440 [TCP segment of a reassembled PDU]
   81   1.617891 192.168.0.17 → 13.107.21.200 TCP 1494 52742 → 443 [ACK] Seq=8320 Ack=2757 Win=261888 Len=1440 [TCP segment of a reassembled PDU]
   82   1.617894 192.168.0.17 → 13.107.21.200 TCP 1494 52742 → 443 [ACK] Seq=9760 Ack=2757 Win=261888 Len=1440 [TCP segment of a reassembled PDU]
   83   1.617896 192.168.0.17 → 13.107.21.200 TCP 1494 52742 → 443 [ACK] Seq=11200 Ack=2757 Win=261888 Len=1440 [TCP segment of a reassembled PDU]
   84   1.617916 192.168.0.17 → 13.107.21.200 TCP 1494 52742 → 443 [ACK] Seq=12640 Ack=2757 Win=261888 Len=1440 [TCP segment of a reassembled PDU]
   85   1.617919 192.168.0.17 → 13.107.21.200 TCP 1494 52742 → 443 [ACK] Seq=14080 Ack=2757 Win=261888 Len=1440 [TCP segment of a reassembled PDU]
   86   1.617921 192.168.0.17 → 13.107.21.200 TCP 1494 52742 → 443 [ACK] Seq=15520 Ack=2757 Win=261888 Len=1440 [TCP segment of a reassembled PDU]
   87   1.617923 192.168.0.17 → 13.107.21.200 TCP 1494 52742 → 443 [ACK] Seq=16960 Ack=2757 Win=261888 Len=1440 [TCP segment of a reassembled PDU]
   88   1.617926 192.168.0.17 → 13.107.21.200 TCP 1494 52742 → 443 [ACK] Seq=18400 Ack=2757 Win=261888 Len=1440 [TCP segment of a reassembled PDU]
   89   1.617928 192.168.0.17 → 13.107.21.200 TLSv1.2 598 Application Data
   90   1.650399 13.107.21.200 → 192.168.0.17 TCP 60 443 → 52742 [ACK] Seq=2757 Ack=4000 Win=261376 Len=0
   91   1.650400 13.107.21.200 → 192.168.0.17 TCP 60 443 → 52742 [ACK] Seq=2757 Ack=6880 Win=262656 Len=0
   92   1.650465 192.168.0.17 → 13.107.21.200 TCP 1494 [TCP segment of a reassembled PDU]
   93   1.650471 192.168.0.17 → 13.107.21.200 TCP 1494 52742 → 443 [ACK] Seq=21824 Ack=2757 Win=261888 Len=1440 [TCP segment of a reassembled PDU]

